<?xml version="1.0"?>
<!DOCTYPE Report
[
<!ELEMENT Report (General ,(Doc|BPT)) >
<!ATTLIST Report ver CDATA #REQUIRED tmZone CDATA #REQUIRED>

<!ELEMENT General ( DocLocation ) >
<!ATTLIST General productName CDATA #REQUIRED productVer CDATA #REQUIRED os CDATA #REQUIRED host CDATA #REQUIRED qcserver CDATA #IMPLIED qcproject CDATA #IMPLIED SolManSolutionId CDATA #IMPLIED SolManProjectId CDATA #IMPLIED SolManTestPlanId CDATA #IMPLIED SolManTestPackageId CDATA #IMPLIED SolManUserInfoData CDATA #IMPLIED  >

<!ELEMENT BPT (DName,Res,DVer?,TSet?,TInst?,NodeArgs,AdditionalInfo*,Doc*) >
<!ATTLIST BPT rID ID #REQUIRED >

<!ELEMENT Doc (DName,ConfName?,Res,DVer?,TSet?,TInst?,RunType?,DT?,AdditionalInfo*,Step*,DIter*,Step*,Action*,Doc*,Summary?,TestMaintenanceSummary*,NodeArgs?) >
<!ATTLIST Doc rID ID #REQUIRED type (Test|BC|BPTWrapperTest|Flow|Group|Action) "Test" productName CDATA #REQUIRED BCIter CDATA #IMPLIED >

<!ELEMENT RunType ( #PCDATA )>
<!ATTLIST RunType fmStep (False|True) "False" batch (False|True) "False" upDesc (False|True) "False" upChk (False|True) "False" upAS (False|True) "False">

<!ELEMENT DName ( #PCDATA ) >

<!ELEMENT ConfName ( #PCDATA ) >

<!ELEMENT Res ( #PCDATA ) >

<!ELEMENT AdditionalInfo (AdditionalDataName,AdditionalDataValue ) >

<!ELEMENT AdditionalDataName ( #PCDATA ) >

<!ELEMENT AdditionalDataValue ( #PCDATA ) >

<!ELEMENT DVer ( #PCDATA ) >

<!ELEMENT TSet ( #PCDATA ) >

<!ELEMENT TInst ( #PCDATA ) >

<!ELEMENT DIter (Step*,Action+,Summary?,NodeArgs)>
<!ATTLIST DIter rID ID #REQUIRED iterID CDATA #REQUIRED>

<!ELEMENT DocLocation ( #PCDATA )>

<!ELEMENT Action (AName,AIter*,(Step|HtmlStep|Action)*, Summary,ActionMaintenanceSummary*, NodeArgs ) >
<!ATTLIST Action rID ID #REQUIRED>

<!ELEMENT AIter ((Step|HtmlStep|Action)*,DataMapping?, Summary?,NodeArgs) >
<!ATTLIST AIter rID ID #REQUIRED iterID CDATA #REQUIRED isCountable (False|True) "False" >

<!ELEMENT AName ( #PCDATA ) >

<!ELEMENT TestMaintenanceSummary (ActionMaintenanceSummary*) >
<!ATTLIST TestMaintenanceSummary ObjectsAdded CDATA #REQUIRED ObjectsUpdated CDATA #REQUIRED StepsUpdated CDATA #REQUIRED StepsComments CDATA #REQUIRED><!ELEMENT ActionMaintenanceSummary (ObjectChange* ) >
<!ATTLIST ActionMaintenanceSummary Action CDATA #REQUIRED Objects CDATA #REQUIRED Updated CDATA #REQUIRED LinesTotal CDATA #REQUIRED Added CDATA #REQUIRED LinesUpdated CDATA #REQUIRED>

<!ELEMENT ObjectChange  (Hierarchy, PropertyChangeList* ) >
<!ATTLIST ObjectChange Operation CDATA #IMPLIED OriginalRepository CDATA #IMPLIED>

<!ELEMENT PropertyChangeList (PropertyDef*) >

<!ELEMENT PropertyDef (OriginalValue, NewValue) >
<!ATTLIST PropertyDef PropName CDATA #REQUIRED OriginRegularExpression (True|False) "False" NewRegularExpression (True|False) "False" AddedProperty (True|False) "False" >

<!ELEMENT OriginalValue ( #PCDATA )>

<!ELEMENT NewValue ( #PCDATA )>

<!ELEMENT Hierarchy  (ObjectName, Hierarchy*) >
<!ATTLIST Hierarchy MicClass CDATA #REQUIRED>

<!ELEMENT ObjectName  ( #PCDATA ) >

<!ELEMENT Step (Obj,Details,Time,TimeTick* ,(Step|HtmlStep|Doc)*, DataMapping?, NodeArgs) >
<!ATTLIST Step rID ID #REQUIRED retval CDATA #IMPLIED>

<!ELEMENT HtmlStep (HTML,TimeTick*,(Step|HtmlStep|Doc)*,NodeArgs) >
<!ATTLIST HtmlStep rID ID #REQUIRED >

<!ELEMENT Obj ( #PCDATA ) >
<!ATTLIST Obj plainTxt (False|True) "True">

<!ELEMENT Details ( #PCDATA ) >
<!ATTLIST Details plainTxt (False|True) "True">

<!ELEMENT Time ( #PCDATA ) >

<!ELEMENT HTML ( #PCDATA ) >

<!ELEMENT Disp ( #PCDATA ) >

<!ELEMENT TimeTick ( #PCDATA ) >

<!ELEMENT DataMapping ( DataMappedItem* )>
<!ELEMENT DataMappedItem EMPTY >
<!ATTLIST DataMappedItem dsName CDATA #REQUIRED >
<!ATTLIST DataMappedItem rowId CDATA #REQUIRED >

<!ELEMENT NodeArgs (Disp,TopPane?,BtmPane?,ExtendedInfo? )>
<!ATTLIST NodeArgs eType CDATA #REQUIRED icon CDATA #REQUIRED nRep CDATA #REQUIRED UserNote CDATA #IMPLIED filter (False|True) "True">
<!ATTLIST NodeArgs status (Passed|Failed|Done|Warning|Information) "Done">
<!ATTLIST NodeArgs iconSel CDATA #IMPLIED nType CDATA #IMPLIED MovieMarker CDATA "">
<!ATTLIST NodeArgs Source CDATA #IMPLIED SourceLine CDATA #IMPLIED StepFlowItemKey CDATA #IMPLIED >

<!ELEMENT TopPane (Path)>

<!ELEMENT BtmPane ( (Path|WR)?,ASHilite?)>
<!ATTLIST BtmPane vType CDATA "HTML">

<!ELEMENT Path ( #PCDATA ) >

<!ELEMENT ASHilite ( #PCDATA ) >

<!ELEMENT WR ( #PCDATA ) >

<!ELEMENT ExtendedInfo ( StepData ) >

<!ATTLIST ExtendedInfo StepType CDATA #REQUIRED>
<!ELEMENT DT (NodeArgs) >
<!ATTLIST DT rID ID #REQUIRED>

<!ELEMENT Summary (Param*)>
<!ATTLIST Summary sTime CDATA #IMPLIED eTime CDATA #IMPLIED passed CDATA #IMPLIED failed CDATA #IMPLIED warnings CDATA #IMPLIED retval CDATA #IMPLIED stopped (False|True) "False" >

<!ELEMENT Param (ParamName,ParamVal)+ >
<!ATTLIST Param paramInOut (In|Out) "In">

<!ELEMENT ParamName ( #PCDATA ) >

<!ELEMENT ParamVal ( #PCDATA ) >

]
>
<Report ver="2.0" tmZone="India Standard Time">
<General productName="HPE Unified Functional Testing" productVer="14.03" os="" host="LAPTOP-PM5JGNDH"><DocLocation><![CDATA[C:\Temp\Keyword Driver framework\Driver\Driver]]></DocLocation></General>
<Doc rID="T1"   productName= "HPE Unified Functional Testing"  >
<DName><![CDATA[Driver]]></DName>
<Res><![CDATA[Res45]]></Res>
<DT rID="T2">
<NodeArgs eType="Table" icon="2" nRep="4" filter="False" >
<Disp><![CDATA[Run-Time Data Table]]></Disp>
<BtmPane vType="Table" >
<Path><![CDATA[Default.xls]]></Path>
</BtmPane>
</NodeArgs>
</DT>
<DIter rID="T3" iterID="1" >
<Action rID="T4">
<AName><![CDATA[Action1]]></AName>
<Step rID="T5">
<Obj plainTxt="False" ><![CDATA[SystemUtil]]></Obj>
<Details plainTxt="False" ><![CDATA[SystemUtil]]></Details>
<Time><![CDATA[30/03/2022 - 18:01:24]]></Time>
<TimeTick>1648643484</TimeTick>
<Step rID="T6">
<Obj plainTxt="False" ><![CDATA[Run "C:\Program Files (x86)\HPE\Unified Functional Testing\samples\Flights Application\FlightsGUI.exe",1]]></Obj>
<Details plainTxt="False" ><![CDATA[Run "C:\Program Files (x86)\HPE\Unified Functional Testing\samples\Flights Application\FlightsGUI.exe",1]]></Details>
<Time><![CDATA[30/03/2022 - 18:01:24]]></Time>
<TimeTick>1648643484</TimeTick>
<NodeArgs eType="Replay" icon="5" nRep="11" status="Passed" >
<Disp><![CDATA[Run "C:\Program Files (x86)\HPE\Unified Functional Testing\samples\Flights Application\FlightsGUI.exe",1]]></Disp>
</NodeArgs>
</Step>
<NodeArgs eType="Replay" icon="5" nRep="10" status="Passed" >
<Disp><![CDATA[SystemUtil]]></Disp>
</NodeArgs>
</Step>
<Step rID="T7">
<Obj plainTxt="False" ><![CDATA[HPE MyFlight Sample Applicatio]]></Obj>
<Details plainTxt="False" ><![CDATA[WpfWindow]]></Details>
<Time><![CDATA[30/03/2022 - 18:02:05]]></Time>
<TimeTick>1648643525</TimeTick>
<Step rID="T8">
<Obj plainTxt="False" ><![CDATA[agentName.Set]]></Obj>
<Details plainTxt="False" ><![CDATA["john"]]></Details>
<Time><![CDATA[30/03/2022 - 18:02:05]]></Time>
<TimeTick>1648643525</TimeTick>
<NodeArgs eType="Replay" icon="7" nRep="16" >
<Disp><![CDATA[agentName.Set]]></Disp>
</NodeArgs>
</Step>
<Step rID="T9">
<Obj plainTxt="False" ><![CDATA[password.Set]]></Obj>
<Details plainTxt="False" ><![CDATA["hp"]]></Details>
<Time><![CDATA[30/03/2022 - 18:02:06]]></Time>
<TimeTick>1648643526</TimeTick>
<NodeArgs eType="Replay" icon="7" nRep="18" >
<Disp><![CDATA[password.Set]]></Disp>
</NodeArgs>
</Step>
<Step rID="T10">
<Obj plainTxt="False" ><![CDATA[OK.Click]]></Obj>
<Details plainTxt="False" ><![CDATA[]]></Details>
<Time><![CDATA[30/03/2022 - 18:02:06]]></Time>
<TimeTick>1648643526</TimeTick>
<NodeArgs eType="Replay" icon="8" nRep="20" >
<Disp><![CDATA[OK.Click]]></Disp>
</NodeArgs>
</Step>
<Step rID="T11">
<Obj plainTxt="False" ><![CDATA[HPE MyFlight Sample Applicatio.Exist]]></Obj>
<Details plainTxt="False" ><![CDATA["Object exists"]]></Details>
<Time><![CDATA[30/03/2022 - 18:02:07]]></Time>
<TimeTick>1648643527</TimeTick>
<NodeArgs eType="Replay" icon="6" nRep="21" >
<Disp><![CDATA[HPE MyFlight Sample Applicatio.Exist]]></Disp>
</NodeArgs>
</Step>
<NodeArgs eType="Context" icon="6" nRep="15" >
<Disp><![CDATA[HPE MyFlight Sample Applicatio]]></Disp>
</NodeArgs>
</Step>
<Step rID="T12">
<Obj ><![CDATA[Login]]></Obj>
<Details ><![CDATA[Login Successful]]></Details>
<Time><![CDATA[30/03/2022 - 18:02:07]]></Time>
<TimeTick>1648643527</TimeTick>
<NodeArgs eType="User" icon="9" nRep="22" status="Passed" >
<Disp><![CDATA[Login]]></Disp>
</NodeArgs>
</Step>
<Step rID="T13">
<Obj plainTxt="False" ><![CDATA[HPE MyFlight Sample Applicatio_2]]></Obj>
<Details plainTxt="False" ><![CDATA[WpfWindow]]></Details>
<Time><![CDATA[30/03/2022 - 18:02:10]]></Time>
<TimeTick>1648643530</TimeTick>
<Step rID="T14">
<Obj plainTxt="False" ><![CDATA[HPE MyFlight Sample Applicatio_2.Close]]></Obj>
<Details plainTxt="False" ><![CDATA[]]></Details>
<Time><![CDATA[30/03/2022 - 18:02:10]]></Time>
<TimeTick>1648643530</TimeTick>
<NodeArgs eType="Replay" icon="6" nRep="25" >
<Disp><![CDATA[HPE MyFlight Sample Applicatio_2.Close]]></Disp>
</NodeArgs>
</Step>
<NodeArgs eType="Context" icon="6" nRep="24" >
<Disp><![CDATA[HPE MyFlight Sample Applicatio_2]]></Disp>
</NodeArgs>
</Step>
<Step rID="T15">
<Obj plainTxt="False" ><![CDATA[HPE MyFlight Sample Applicatio]]></Obj>
<Details plainTxt="False" ><![CDATA[WpfWindow]]></Details>
<Time><![CDATA[30/03/2022 - 18:02:21]]></Time>
<TimeTick>1648643541</TimeTick>
<Step rID="T16">
<Obj plainTxt="False" ><![CDATA[HPE MyFlight Sample Applicatio.Exist]]></Obj>
<Details plainTxt="False" ><![CDATA["Object does not exist"]]></Details>
<Time><![CDATA[30/03/2022 - 18:02:21]]></Time>
<TimeTick>1648643541</TimeTick>
<NodeArgs eType="Replay" icon="6" nRep="28" >
<Disp><![CDATA[HPE MyFlight Sample Applicatio.Exist]]></Disp>
</NodeArgs>
</Step>
<NodeArgs eType="Context" icon="6" nRep="27" >
<Disp><![CDATA[HPE MyFlight Sample Applicatio]]></Disp>
</NodeArgs>
</Step>
<Step rID="T17">
<Obj ><![CDATA[Closeapp]]></Obj>
<Details ><![CDATA[Closeapp unSuccessful]]></Details>
<Time><![CDATA[30/03/2022 - 18:02:21]]></Time>
<TimeTick>1648643541</TimeTick>
<NodeArgs eType="User" icon="9" nRep="29" status="Passed" >
<Disp><![CDATA[Closeapp]]></Disp>
</NodeArgs>
</Step>
<Step rID="T18">
<Obj plainTxt="False" ><![CDATA[SystemUtil]]></Obj>
<Details plainTxt="False" ><![CDATA[SystemUtil]]></Details>
<Time><![CDATA[30/03/2022 - 18:02:23]]></Time>
<TimeTick>1648643543</TimeTick>
<Step rID="T19">
<Obj plainTxt="False" ><![CDATA[Run "C:\Program Files (x86)\HPE\Unified Functional Testing\samples\Flights Application\FlightsGUI.exe",1]]></Obj>
<Details plainTxt="False" ><![CDATA[Run "C:\Program Files (x86)\HPE\Unified Functional Testing\samples\Flights Application\FlightsGUI.exe",1]]></Details>
<Time><![CDATA[30/03/2022 - 18:02:23]]></Time>
<TimeTick>1648643543</TimeTick>
<NodeArgs eType="Replay" icon="5" nRep="33" status="Passed" >
<Disp><![CDATA[Run "C:\Program Files (x86)\HPE\Unified Functional Testing\samples\Flights Application\FlightsGUI.exe",1]]></Disp>
</NodeArgs>
</Step>
<NodeArgs eType="Replay" icon="5" nRep="32" status="Passed" >
<Disp><![CDATA[SystemUtil]]></Disp>
</NodeArgs>
</Step>
<Step rID="T20">
<Obj plainTxt="False" ><![CDATA[HPE MyFlight Sample Applicatio]]></Obj>
<Details plainTxt="False" ><![CDATA[WpfWindow]]></Details>
<Time><![CDATA[30/03/2022 - 18:02:35]]></Time>
<TimeTick>1648643555</TimeTick>
<Step rID="T21">
<Obj plainTxt="False" ><![CDATA[agentName.Set]]></Obj>
<Details plainTxt="False" ><![CDATA["john"]]></Details>
<Time><![CDATA[30/03/2022 - 18:02:35]]></Time>
<TimeTick>1648643555</TimeTick>
<NodeArgs eType="Replay" icon="7" nRep="38" >
<Disp><![CDATA[agentName.Set]]></Disp>
</NodeArgs>
</Step>
<Step rID="T22">
<Obj plainTxt="False" ><![CDATA[password.Set]]></Obj>
<Details plainTxt="False" ><![CDATA["hp"]]></Details>
<Time><![CDATA[30/03/2022 - 18:02:35]]></Time>
<TimeTick>1648643555</TimeTick>
<NodeArgs eType="Replay" icon="7" nRep="40" >
<Disp><![CDATA[password.Set]]></Disp>
</NodeArgs>
</Step>
<Step rID="T23">
<Obj plainTxt="False" ><![CDATA[OK]]></Obj>
<Details plainTxt="False" ><![CDATA[Object&nbsp;is&nbsp;disabled]]></Details>
<Time><![CDATA[30/03/2022 - 18:02:35]]></Time>
<TimeTick>1648643555</TimeTick>
<Step rID="T24">
<Obj plainTxt="False" ><![CDATA[OK]]></Obj>
<Details plainTxt="False" ><![CDATA[Object's physical description:<br>Text = OK<br>devname = okButton<br>]]></Details>
<Time><![CDATA[30/03/2022 - 18:02:35]]></Time>
<TimeTick>1648643555</TimeTick>
<NodeArgs eType="Replay" icon="10" nRep="42" status="Warning" nType="Description" >
<Disp><![CDATA[OK]]></Disp>
</NodeArgs>
</Step>
<NodeArgs eType="Replay" icon="8" nRep="41" status="Failed" nType="Run Error" >
<Disp><![CDATA[OK]]></Disp>
</NodeArgs>
</Step>
<NodeArgs eType="Context" icon="6" nRep="37" status="Failed" >
<Disp><![CDATA[HPE MyFlight Sample Applicatio]]></Disp>
</NodeArgs>
</Step>
<Step rID="T25">
<Obj plainTxt="False" ><![CDATA[HPE MyFlight Sample Applicatio]]></Obj>
<Details plainTxt="False" ><![CDATA[WpfWindow]]></Details>
<Time><![CDATA[30/03/2022 - 18:02:35]]></Time>
<TimeTick>1648643555</TimeTick>
<Step rID="T26">
<Obj plainTxt="False" ><![CDATA[Run Error]]></Obj>
<Details plainTxt="False" ><![CDATA[Object is disabled<BR/>Function file: C:\Temp\Keyword Driver framework\Driver\Library2.qfl<BR/>Line (6): &quot;WpfWindow(&quot;HPE MyFlight Sample Applicatio&quot;).WpfButton(&quot;OK&quot;).Click&quot;.]]></Details>
<Time><![CDATA[30/03/2022 - 18:02:36]]></Time>
<TimeTick>1648643556</TimeTick>
<NodeArgs eType="Replay" icon="10" nRep="44" status="Failed" Source="C:\Temp\Keyword Driver framework\Driver\Library2.qfl" SourceLine="5" >
<Disp><![CDATA[Run Error]]></Disp>
<BtmPane vType="ViewerGen.SSViewerGen" >
<Path><![CDATA[ZIP::Act1\Row0\ssf2.xml]]></Path>
<ASHilite><![CDATA[657126]]></ASHilite>
</BtmPane>
</NodeArgs>
</Step>
<Step rID="T27">
<Obj plainTxt="False" ><![CDATA[HPE MyFlight Sample Applicatio.Exist]]></Obj>
<Details plainTxt="False" ><![CDATA["Object exists"]]></Details>
<Time><![CDATA[30/03/2022 - 18:02:50]]></Time>
<TimeTick>1648643570</TimeTick>
<NodeArgs eType="Replay" icon="6" nRep="45" Source="C:\Temp\Keyword Driver framework\Driver\Library2.qfl" SourceLine="-1" >
<Disp><![CDATA[HPE MyFlight Sample Applicatio.Exist]]></Disp>
</NodeArgs>
</Step>
<NodeArgs eType="Context" icon="6" nRep="43" status="Failed" Source="C:\Temp\Keyword Driver framework\Driver\Library2.qfl" SourceLine="-1" >
<Disp><![CDATA[HPE MyFlight Sample Applicatio]]></Disp>
<BtmPane vType="ViewerGen.SSViewerGen" >
<Path><![CDATA[ZIP::Act1\Row0\ssf1.xml]]></Path>
<ASHilite><![CDATA[657126]]></ASHilite>
</BtmPane>
</NodeArgs>
</Step>
<Step rID="T28">
<Obj ><![CDATA[Login]]></Obj>
<Details ><![CDATA[Login Successful]]></Details>
<Time><![CDATA[30/03/2022 - 18:02:50]]></Time>
<TimeTick>1648643570</TimeTick>
<NodeArgs eType="User" icon="9" nRep="46" status="Passed" Source="C:\Temp\Keyword Driver framework\Driver\Library2.qfl" SourceLine="-1" >
<Disp><![CDATA[Login]]></Disp>
</NodeArgs>
</Step>
<Step rID="T29">
<Obj plainTxt="False" ><![CDATA[HPE MyFlight Sample Applicatio_2]]></Obj>
<Details plainTxt="False" ><![CDATA[WpfWindow]]></Details>
<Time><![CDATA[30/03/2022 - 18:03:15]]></Time>
<TimeTick>1648643595</TimeTick>
<Step rID="T30">
<Obj plainTxt="False" ><![CDATA[WpfTabStrip]]></Obj>
<Details plainTxt="False" ><![CDATA[Cannot&nbsp;identify&nbsp;the&nbsp;object&nbsp;"WpfTabStrip"&nbsp;(of&nbsp;class&nbsp;WpfTabStrip).<br/>Verify&nbsp;that&nbsp;this&nbsp;object's&nbsp;properties&nbsp;match&nbsp;an&nbsp;object&nbsp;currently&nbsp;displayed&nbsp;in&nbsp;your&nbsp;application.]]></Details>
<Time><![CDATA[30/03/2022 - 18:03:15]]></Time>
<TimeTick>1648643595</TimeTick>
<Step rID="T31">
<Obj plainTxt="False" ><![CDATA[WpfTabStrip]]></Obj>
<Details plainTxt="False" ><![CDATA[Object's physical description:<br>wpftypename = tab<br>devnamepath = ;;<br>devname = <br>]]></Details>
<Time><![CDATA[30/03/2022 - 18:03:15]]></Time>
<TimeTick>1648643595</TimeTick>
<NodeArgs eType="Replay" icon="10" nRep="51" status="Warning" nType="Description" >
<Disp><![CDATA[WpfTabStrip]]></Disp>
</NodeArgs>
</Step>
<NodeArgs eType="Replay" icon="11" nRep="50" status="Failed" nType="Run Error" >
<Disp><![CDATA[WpfTabStrip]]></Disp>
</NodeArgs>
</Step>
<NodeArgs eType="Context" icon="6" nRep="49" status="Failed" >
<Disp><![CDATA[HPE MyFlight Sample Applicatio_2]]></Disp>
</NodeArgs>
</Step>
<Step rID="T32">
<Obj plainTxt="False" ><![CDATA[HPE MyFlight Sample Applicatio_2]]></Obj>
<Details plainTxt="False" ><![CDATA[WpfWindow]]></Details>
<Time><![CDATA[30/03/2022 - 18:03:15]]></Time>
<TimeTick>1648643595</TimeTick>
<Step rID="T33">
<Obj plainTxt="False" ><![CDATA[Run Error]]></Obj>
<Details plainTxt="False" ><![CDATA[Cannot identify the object &quot;WpfTabStrip&quot; (of class WpfTabStrip).<BR/>Verify that this object's properties match an object currently displayed in your application.<BR/>Function file: C:\Temp\Keyword Driver framework\Driver\Library2.qfl<BR/>Line (29): &quot;	WpfWindow(&quot;HPE MyFlight Sample Applicatio_2&quot;).WpfTabStrip(&quot;WpfTabStrip&quot;).Select &quot;SEARCH ORDER&quot;&quot;.]]></Details>
<Time><![CDATA[30/03/2022 - 18:03:16]]></Time>
<TimeTick>1648643596</TimeTick>
<NodeArgs eType="Replay" icon="10" nRep="53" status="Failed" Source="C:\Temp\Keyword Driver framework\Driver\Library2.qfl" SourceLine="28" >
<Disp><![CDATA[Run Error]]></Disp>
<BtmPane vType="ViewerGen.SSViewerGen" >
<Path><![CDATA[ZIP::Act1\Row0\ssf4.xml]]></Path>
<ASHilite><![CDATA[657126]]></ASHilite>
</BtmPane>
</NodeArgs>
</Step>
<Step rID="T34">
<Obj plainTxt="False" ><![CDATA[Stop Run]]></Obj>
<Details plainTxt="False" ><![CDATA[Run stopped by user.]]></Details>
<Time><![CDATA[30/03/2022 - 18:03:22]]></Time>
<TimeTick>1648643602</TimeTick>
<NodeArgs eType="General" icon="12" nRep="54" status="Information" >
<Disp><![CDATA[Stop Run]]></Disp>
</NodeArgs>
</Step>
<NodeArgs eType="Context" icon="6" nRep="52" status="Failed" Source="C:\Temp\Keyword Driver framework\Driver\Library2.qfl" SourceLine="-1" >
<Disp><![CDATA[HPE MyFlight Sample Applicatio_2]]></Disp>
<BtmPane vType="ViewerGen.SSViewerGen" >
<Path><![CDATA[ZIP::Act1\Row0\ssf3.xml]]></Path>
<ASHilite><![CDATA[657126]]></ASHilite>
</BtmPane>
</NodeArgs>
</Step>
<Summary sTime="30/03/2022 - 18:01:16" eTime="30/03/2022 - 18:03:22" passed="5" failed="4" warnings="2" ></Summary>
<NodeArgs eType="StartAction" icon="4" nRep="7" status="Failed" >
<Disp><![CDATA[Action1 Summary]]></Disp>
</NodeArgs>
</Action>
<NodeArgs eType="StartIteration" icon="3" nRep="6" status="Failed" >
<Disp><![CDATA[Driver Iteration 1 (Row 1)]]></Disp>
</NodeArgs>
</DIter>
<Summary sTime="30/03/2022 - 18:01:15" eTime="30/03/2022 - 18:03:22" passed="5" failed="4" warnings="2" ></Summary>
<NodeArgs eType="StartTest" icon="1" nRep="3" status="Failed" >
<Disp><![CDATA[Test Driver Summary]]></Disp>
</NodeArgs>
</Doc>
</Report>